lat,lon,name,gender,age,history
64.17648305231,-51.7291259765625,Alexandra Messerli,Female,,"Alex Messerli lives and works in Nuuk, Greenland as a researcher at Asiaq Greenland Survey. She was awarded her PhD in Glaciology (geophysics) from the University of Copenhagen Centre for Ice and Climate, Niels Bohr Institute in 2015 and following this worked as a research glaciologist at the Norwegian Polar Institute and then as a remote sensing specialist at Asiaq. She was also chosen to participate in the Arctic Frontiers Emerging Leaders programme, an international and cross-cultural platform for dialogue and exchange to support the arctic leaders of the future.  As a researcher at Asiaq, Alex conducts fieldwork around Greenland, including for the Greenland Ecosystem Monitoring GeoBasis and Glaciobasis programmes and works on wide-ranging national and international projects. Alex is passionate about developing research projects that include local involvement, collaboration and knowledge-sharing with ﬁeldwork and dissemination. For example, her project funded by the Greenlandic Research Council maps snowline evolution on one of Nuuk’s local glaciers in Kobbefjord and works with local guides who can share their knowledge about snow conditions in the Nuuk region. Another of her current collaborative projects, funded by the Nordic Arctic Co-operation Programme, aims to educate tourists and local communities about the natural hazards encountered in Greenland and the wider Arctic. She is also developing a project to map avalanche risk in Nuuk’s backcountry that can be used by local people for route planning and risk assessment, with involvement from the local search and rescue team and snow scooter club and their experience in avalanche occurrence."
39.2854197594374,-76.5829467773438,Nicole Trenholm,Female,Year of Birth = 1986,"On sailing expedition vessels double handed or on massive icebreakers I have mapped uncharted areas in northwest Greenland for the NASA Ocean Melting Greenland Mission. I have investigated uncharted glacial fjords in the Northwest Passage, Devon Ice Cap and what ocean forces are influencing their melt. In 2022 I kick of a decadal Arctic mapping project across the remaining glacial fjords in Greenland, the Canadian Arctic and Alaska. This project is called GO-MARIE Glacier Mapping and Research Interdisciplinary Effort. I will commission the polar expedition vessel RV Marie Tharp next Spring and sail her back to Greenland to kick off the mapping effort that is part of the Seabed2030 United Nation endorsed initiative.  I hope to get the word out about my decadal mapping mission GO-MARIE I need support to continue to fund my resources and crew."
65.6220226151064,-38.935546875,Louise Arner Boyd,Female,1887-1972,"Between 1926 and 1955, American-born Louise Arner Boyd organized, financed and lead seven expeditions by sea to Greenland, Spitsbergen, Jan Mayen Land and Franz Josef Land. One of her earliest trips assisted the 1928 rescue expedition which sought to locate missing Norwegian explorer Roald Amundsen. As her experience grew, so too did the scope of the scientific work conducted on each successive voyage. She hired experts from around the world to carry out field work in geology, oceanography, ecology, glaciology and geomorphology. Supported by the American Geographical Society, Boyd published several books about her adventures including The Fiord Region of East Greenland (1935) and The Coast of Northeast Greenland with Hydrographic Studies in the Greenland Sea (1948). Although her primary role on each trip was as expedition leader, she also served as the ship botanist and photographer. Her detailed photographs, maps and data relating to Greenlandic glacier recession remain of keen interest to contemporary scientists studying climate change.   Boyd’s bravery and scientific contributions won international renown and she received honorary degrees and awards from Norway, France, Sweden, Poland and the United States. She dedicated her whole life to the cause of polar exploration and poured her personal fortune into expeditions aimed at advancing modern science and satisfying her own profound curiosity about the north. Despite the high regard in which she was held by other explorers and scientists during her lifetime, Louise Arner Boyd paid a heavy price and her extraordinary life has largely been forgotten today."
77.4672205389659,-69.2111206054688,Arnarulunnguaq,Female,1896 - 1933,"A Greenlandic Inuit born in Thule, Arnarulunnguaq is recognized as the country’s greatest female explorer due to her participation in Knud Rasmussen’s Fifth Thule Expedition (1921-1924). This lengthy and arduous expedition established cultural connections between the Inuit cultures in Greenland, the United States and Canada and identified the historic origins of the Indigenous Greenlandic people. As a skilled and vital expedition member, Arnarulunnguaq travelled with Rasmussen from Greenland by dogsled, across the Northwest Passage through Alaska and Arctic Canada. As with other Indigenous members of the group, she assumed many roles including translator, guide, dog-driver, seamstress, hunter and cook. Most significantly, given this expedition’s considerable accomplishments, she demonstrated her critical skills as an ethnographer through the interviews she conducted and the connections she made between different Inuit peoples of the region. Arnarulunnguaq’s work includes exquisitely rendered drawings of the tattooing practices of Netsilik Inuit women (published in Rasmussen’s 1931 The Netsilik Eskimos: Social Life and Spiritual Culture). In 1924, she was awarded the Silver Medal of Merit from the Danish government. While her image appears on a Greenlandic postage stamp and she is lauded in a poem by prominent Greenlandic poet and politician Aqqaluk Lynge, plans to erect a permanent statue recognizing her accomplishments, have floundered."
65.6106835027125,-37.6144409179688,Isobel Wylie Hutchison,Female,1889-1982,"Scottish-born Isobel Wylie Hutchison (1889-1982) is representative of many nineteenth-early twentieth century women whose written accounts of contact with Indigenous peoples and observations about the Arctic were dismissed as the mere jottings of a dilettante “lady traveller.” Gently raised at Carlowrie Castle located outside of Edinburgh, Hutchison devoted her life to Arctic travel and science. As an adult, she wrote extensively about her travels for National Geographic Magazine including her 1924 walk across Iceland and her 1933 and 1936 trips to Alaska. She is primarily known for her poetry and the travelogue she wrote about Greenland which reflects the colonialist prejudices of her class. However, it is her work as a botanist collecting thousands of specimens for the prestigious Kew Gardens in England and the Royal Botanic Gardens Edinburgh between 1927-1928, that expanded the world’s knowledge about Greenlandic flora. As a result of this, her efforts were lauded by several geographic societies which still retain and use her collections today. She received the Mungo Park Medal from the Royal Scottish Geographical Society in 1934 ad was awarded the Degree of Doctor of Law by the University of St. Andrews in 1949."
57.4970105213326,-62.5352096557617,Mina Benson Hubbard,Female,1870-1956,"Born near Bewdley, Ontario, Canadian explorer Mina Benson Hubbard (1870-1956) was the first non-Indigenous woman to successfully traverse and map Labrador. Working as a teacher and then a nurse, she married journalist/adventurer Leonidas Hubbard Jr. in 1901. They shared a love of the outdoors and an interest in hiking, boating and nature. In 1903, her husband lead an ill-starred and poorly executed journey up the Naskaupi River into the interior of Labrador. Two years later, following his death by starvation, Mina Benson Hubbard organized and participated in her own rugged expedition to complete her husband’s work to map and photograph this wilderness region. Working with a small team of Métis Cree local guides, Hubbard travelled six hundred miles by canoe from the community of North West River, up the Naskaupi River to Lake Michikimau and then north to the George River outpost on Ungava Bay. Following the successful completion of this arduous two-month undertaking, the first accurate map of the Labrador river system was created. Her book about the expedition entitled A Woman’s Way Through Unknown Labrador, was published in 1908 and provided a detailed and illustrated account of her interactions with the local Innu, Cree, Métis and Inuit and the landscape of the region. Mina Benson Hubbard was named a Fellow of the Royal Geographical Society and a National Historical Person by the Canadian government in 2018."
71.2478876567365,-178.65966796875,Ada Blackjack,Female,1898-1983,"One of the best-known Iñupiaq women in polar history, Ada Blackjack was born in 1898 in Spruce Creek near Nome, Alaska. Educated at a Methodist missionary school, she married young and bore three children- two of whom died as infants. In 1921, divorcing her abusive husband and desperate to earn enough money to care for her surviving child, she accepted the position of seamstress with a four-man expedition to remote Wrangel Island. Organized by Vilhjalmur Stefansson, the team’s objective was to claim and begin colonizing Wrangel for the British Empire. Stefansson was a renowned and charismatic anthropologist and explorer but had a controversial past. Only years earlier, his Canadian Arctic Expedition of 1913-1918 had travelled to the same location. But things ended tragically with Stefansson’s abandonment of his crew and eleven team members dead.  Ada Blackjack was the only Indigenous person and only woman on the 1921 Expedition. Despite her initial lack of outdoor skills and poor treatment by her male colleagues, she proved to be the hardiest and most resilient member of the group. After travelling to Wrangel, the team suffered hardship after the scheduled supply ship failed to appear in 1922. Ada Blackjack spent two years on Wrangel and was the sole survivor of the expedition. Afterwards, she never received her full salary or any benefits from her participation in the expedition. She remarried and lived quietly in Alaska until her death in 1983."
63.7497056023511,-68.5244750976563,Siu-Ling Han,Female,1963-2016.,"Wildlife biologist, environmental professional, and sled dog teamer.  Lived in the Arctic.  Greatly helped the Inuit community, protecting the environment, giving a voice to the people and aid to individuals in need, and raising/working with Inuit dogs in a manner honoring the Inuit tradition.  Bred, trained, and traveled with Inuit sled dogs for nearly two decades, completing, in 2009, a one-month sled journey of over 1,000 km along the East Coast of Baffin Island, from Qikiqtarjuaq to Pond Inlet.  Inspired her mother Kim Han to write “The Canadian Inuit Dog” book.  Worked with Northern Contaminants Program (NCP).  Assessed Inuit human health effects resulting from exposure to POPs (Persistent Organic Pollutants).  Developed liaison with Inuit leaders regarding effective dietary advice compatible with Inuit lifestyles.  Presented the paper “Canadian Perspective on the Long-range Transport of Persistent Pollutants”.  Drafted international protocols for POPs.    (https://www.legacy.com/ca/obituaries/theglobeandmail/name/siu-ling-han-obituary?pid=190000478).  Worked with Government of the Northwest Territories’ wildlife research program and Government of Canada’s Canadian Wildlife Service (CWS), including Northern Region.  Helped bring about signed agreement with the Inuit enabling co-management of protected areas, created Species at Risk course, instigated joint wildlife management efforts, and made sure the people and wildlife of Canada’s North had representation (Bruce MacDonald https://thefanhitch.org/V18N4/V18N4Han.html).    Learned to speak Inuktitut to communicate with Elders.  Created bridges between Inuit and government, ensuring views and experiences of Inuit in protected land areas were heard.    In her last days, Siu-Ling recorded a music CD of her songs, with proceeds going to support mental health initiatives for Inuit youth.  (https://www.cbc.ca/news/canada/north/woman-dying-cancer-records-album-1.3728861)."
33.7563150599271,-118.212890625,Lynne Cox,Female,Born in 1957,"Long-distance open-water swimmer.  Swam in below-freezing waters, amongst icebergs, and across international borders, in the Arctic and Antarctic, to bring peoples and countries together, as documented in her books (""Swimming to Antarctica"").  Toasted by Gorbachev and Reagan (https://www.nps.gov/people/lynne-cox.htm).  In her words:  “My Bering Strait swim in 1987 was one of my most important achievements.  I swam from Little Diomede, USA, to Big Diomede, to open the border between the US and the Soviet Union.  Years later, in 2007, I did a series of swims through the Arctic starting in Greenland, with a swim across Disco Bay in 26.6ºF water (–3ºC) wearing a swimsuit, cap, and goggles.  My objective was to show that we are capable of pushing beyond established limitations.  The swim was part of a series of swims through the Arctic.  I next swam 1 mile in 28.8ºF water (–2ºC) in 25 minutes.  From there I did a mile swim off Gjoa Haven in the Canadian Arctic, a mile swim through Prudhoe Bay, and a mile swim off Barrow in the Chukchi Sea.  I was tracing the route of Roald Amundsen and writing about his being the first person [to navigate there] – probably European person, because there may have been Inuit people who traveled through the Northwest Passage before him.  I wrote about his experience and mine in the book ‘South with The Sun’.  The swims for me were about mapping new territories, entering waterways where no one intentionally swims, exploring the possibilities, and pushing beyond limits.”"
65.6106835027125,-37.6144409179688,Isobel Wylie Hutchison,Female,1889-1982,"Scottish-born Isobel Wylie Hutchison (1889-1982) is representative of many nineteenth-early twentieth century women whose written accounts of contact with Indigenous peoples and observations about the Arctic were dismissed as the mere jottings of a dilettante “lady traveller.” Gently raised at Carlowrie Castle located outside of Edinburgh, Hutchison devoted her life to Arctic travel and science. As an adult, she wrote extensively about her travels for National Geographic Magazine including her 1924 walk across Iceland and her 1933 and 1936 trips to Alaska. She is primarily known for her poetry and the travelogue she wrote about Greenland which reflects the colonialist prejudices of her class. However, it is her work as a botanist collecting thousands of specimens for the prestigious Kew Gardens in England and the Royal Botanic Gardens Edinburgh between 1927-1928, that expanded the world’s knowledge about Greenlandic flora. As a result of this, her efforts were lauded by several geographic societies which still retain and use her collections today. She received the Mungo Park Medal from the Royal Scottish Geographical Society in 1934 ad was awarded the Degree of Doctor of Law by the University of St. Andrews in 1949."
58.1105380521779,-68.3919525146485,Sheila Watt-Cloutier,Female,1953,"Sheila Watt-Cloutier was born in 1953 in Kuujjuaq, Nunavik, Canada. The daughter of respected Kuujjuaq healer Daisy Watt, Watt-Cloutier conducted early work to improve health conditions and education in Nunavik. As Corporate Secretary of Makivik Corporation, she oversaw the administration of the Inuit lands-claim body established under the James Bay and Northern Québec Agreement and played a prominent role during negotiations leading up to and during the Global Convention on Persistent Pollutants in the late 1990s. She is noted for her adroitness and skill in raising the profile of Arctic Aboriginal peoples on the international stage and in creating effective partnerships between Aboriginal organizations and governments. A fearless environmentalist and tireless advocate on behalf of the Arctic Inuit  whose culture and livelihood is threatened by climate change, Watt-Cloutier is a former International Chair of the Inuit Circumpolar Council and a former nominee for the Nobel Peace Prize. She is the author of The Right to Be Cold which investigates how Inuit communities have been adversely affected by climate change. She currently lives in Kuujjuaq, Nunavik."
75.3665874325199,-92.3991394042969,Josephine Diebitsch Peary,Female,1863-1955,"Married to explorer Robert Peary, American Josephine Diebitsch-Peary (1863-1955) accompanied him to Greenland in 1891 and played a critical role in managing the base camp at McCormick Bay. Here she was engaged in hunting, food preparation and distribution as well as assisting in the collection of ethnological data. In 1894, she travelled to Greenland for a second time. Her books about Greenland for adults and children are illuminating as they mirror the prevalent exoticized attitudes towards Indigenous peoples of the North and reflect one Western woman’s perspective about Inuit culture and way of life. She had a conflicted relationship with Peary’s Inuit “country wife” Aleqasina who herself provided Peary with a home base, mothered two of his children, sewed his clothing and offered him emotional support prior to his expeditions. Diebitsch-Peary’s written work and her correspondence highlight the historic colonialist relationships that existed between Westerners and Indigenous peoples in Greenland. Despite controversies that swirled around Robert Peary, she remained committed to him throughout her life. Her life-long work on his behalf including fundraising, cultivating necessary social contacts and handling the shipping and transportation of expedition goods remained unacknowledged."
40.1284910568541,26.4111328125,Ebru Caymaz,Female,,"I'm assistant professor from Canakkale Onsekiz Mart University, Turkey. My first PhD is in the field of Business Administration and I am mainly concentrated on sustainable development. In order to conduct further interdisciplinary studies, I have currently been attending my 2nd PhD lectures in the field of International Relations.I have been studying and trying to develop an inclusive / adaptive governance framework for the Arctic communities.  I have traveled through Greenland twice and conducted in-depth interviews with the local communities. Moreover, I've attended several conferences (such as Arctic Science Summit Week, Arctic Frontiers, Arctic Social Sciences Conference and Arctic Change) and exchanged my views to further develop my model.  Besides, Iam working on science diplomacy which enables an inclusive (holistic), interdisciplinary and international research process that would promote inclusion of traditional knowledge while enhancing resilience efforts. Therefore, developing a scholar network and being an active member is highly significant in terms of polar science diplomacy. At the nexus of science and diplomacy, based upon the pillars of political will, diplomatic involvement as well as governmental support, polar science diplomacy holds the potential to unify resilience efforts pertaining to the poles."
78.2513874950671,15.64453125,Hanna Marie Resvoll-Holmsen,Female,1873-1943,"Norwegian-born Hanna Marie Resvoll-Holmsen (1873-1943) was raised in a liberal family that valued advanced education for women. While still a science student at Det Kongelige Frederiks Universitet (later the University of Oslo), she joined the 1907 expedition to Svalbard lead by oceanographer Prince Albert I of Monaco in the capacity of botanist. She won the respect of her colleagues including geologist Adolf Hoel and thrived on the rugged beauty and remoteness of this region. The fieldwork she conducted lead to the discovery of new species particularly throughout western Svalbard. After surveying plant life in Finnmark in 1909, she was granted the equivalent of a master’s degree and her dissertation was one of Norway’s first on botany. She was an educator, poet and a prolific writer with several published works on alpine and Arctic plants including ""Svalbards Flora"" (Cappelens, 1927). Resvoll-Homsen was one of the first Norwegian scientists to use colour photography in her work as well as employ statistical methods in vegetation surveys. She was also a keen conservationist and advocated for the protection of north-west Svalbard and Bjørnøya. Her sister, Thekla Resvoll (1871-1948) shared her passion for botany and conservation work and was a well-known supporter of the women’s rights movement in Norway."
65.3118292538372,-65.8740234375,Hannah Ebierbing (Tookoolito/Taqulittuq),Female,1838-1876,"Hannah Ebierbing/Tookoolito/Taqulittuq (1838-1876)  Born in the Cumberland Sound region in what is now Nunavut, Canada, Hannah Ebierbing (also known as “Tookoolito” and “Taqulittuq”) was a translator and guide who, along with her husband Ipiirvik (also known as “Joe Ebierbing”), accompanied whaler Captain William Penny and later, American explorer Charles Francis Hall on several expeditions to the Canadian Arctic. Hall was determined to find survivors from the 1845 Franklin Expedition or, at the very least, discover their fate. Hannah Ebierbing played a critical role in eliciting traditional knowledge from Baffin Island Inuit regarding the outcome of this expedition. Hannah was a member of Hall’s ill-fated 1871 Polaris Expedition that ended at Hall Basin in North West Greenland. After Hall’s death, Hannah, her husband Joe and another Inuit team member Suersaq travelled to safety on an ice floe over two thousand kilometres with sixteen surviving members of the Polaris Expedition. Hannah and her husband were recognized by the Canadian government as National Historic Persons."
63.7469,-68.5173,Sylvia Cloutier,,,"Sylvia Cloutier originally from Kuujjuaq, Nunavik (Northern Quebec) living in Iqaluit, Nunavut, is a mother, performing artist, producer, director, well known for performing Inuit throat singing and drum dancing. She is the co-founder of a performance company Aqsarniit producing shows that promote Inuit culture for special events such as the Nunavut Celebration at the Museum of Civilization in April 1999, Toonik Tyme and Alianait festival in Iqaluit, Canadian North’s Nunavut Day Gala in 2007, and fashion shows for the Government of Nunavut promoting the high fashion seal skin products. She has collaborated with many artists globally including Think of One from Belgium; Tafelmusik, a Toronto based baroque orchestra; Montréal based DJ Geronimo Inutiq and the National Symphony Orchestra. Sylvia was the producer for a television series Inuit Piqqusingit with Inuit Communication Systems Limited in 2000 learning about Inuit survival skills across Nunavut. She has also been involved as a motivational speaker for youth events and has worked extensively with creating training for youth in creative projects while addressing social issues such as video production, the development of murals, social theatre, music, dance and circus. She joined her Excellency Governor General Michaëlle Jean on the state visit to Norway and Ukraine in 2009 and was named “Woman of the Year” by Pauktutiit, the national Inuit women’s organization and later received an award for “Outstanding young woman of the year” by Qullit Nunavut women’s organization in 2013. Sylvia is the producer and co-director of TULUGAK bringing together Inuit performing artists from Canada and Greenland since 2011. In August 2025 she performed at Qooqqut Festival in Greenland with HH Suersaq."
61.046,-69.617,Beatrice Deer,,Born: 1982,"Acclaimed “Inuindie” pop star Beatrice Deer is a singer-songwriter based in Montreal. Half Inuk and half Mohawk, Beatrice was born and raised in Nunavik, Quebec, in the small village of Quaqtaq. She has released six studio albums, including her newest, SHIFTING. Her award-winning songs are crafted upon deeply personal lyrics and blend indie rock and modern folk with traditional Inuit stories and throat singing. The recipient of a 2021 Prism Prize and an Apple Music Ambassador, Beatrice Deer sings in three languages: Inuktitut, English, and French. A beloved figure in Arctic Canada, she has performed worldwide, from the Venice Biennale to Norway's Førde Traditional and World Music Festival to the Heard Museum in Phoenix, Arizona. Beatrice's previous full-length album, My All To You, won the 2018 Canadian Folk Music Award in the Pushing the Boundaries category, and Best Folk Album at the 2019 Indigenous Music Awards. In 2022, the award-winning TV short Angakuksajaujuq: The Shaman's Apprentice, for which Beatrice composed the musical score, was shortlisted for an Oscar nomination for Best Animated Short Film. Beatrice Deer's sixth studio album, SHIFTING, explores the process of getting closer to the place where we're meant to be in life. “Emotionally, spiritually, and physically, the transition toward our authentic selves continues,” she says. “As I shift into the position where I'm meant to be, I want to keep using what I've learned to help others.” A role model to her community and a stalwart advocate for mental health, Beatrice feels strongly that each of us, no matter what we've been through, has the ability to transform our personal outlook. Her message, whether shared in song or at speaking engagements, comes from her own lived experience of overcoming countless obstacles. “You can't be a changemaker if you haven't gone through it yourself,” Bea says. “You can't help without healing yourself first. You can't change what happened; you can only change how you deal with it.” https://beatricedeerband.com/bio"
