lat,lon,name,gender,age,history
63.95,-70.2,Kenojuak Ashevak,,Born: 1927,"With a career spanning more than five decades, Kenojuak Ashevak (1927 – 2013) was part of a pioneering generation of Arctic creators from Kinngait (Cape Dorset) in Nunavut. She enjoyed an illustrious international career and continues to be regarded as one of Canada’s preeminent Inuit artists and cultural icons. Since beginning to experiment with drawing in the 1950s, she has produced a vast body of work, mainly utilizing graphite, coloured pencils and felt-tip pens on paper. Kenojuak approached her work with a strong creative intuition. Her drawings would emerge almost unconsciously – a process she would describe as her hand leading her mind. Her aesthetic approach is easily noticeable, with archetypal drawings that captured images of birds, fish, bears and mystical figures. Her highly idiosyncratic imagery is perhaps one of the most recognizable of any Canadian artist and has been included on stamps, coins and, more recently, the ten-dollar banknote. Kenojuak’s work exudes a bright vibrant energy with a touch of whimsy, all wrapped in a pure wonder for the natural world. Her work has been featured in nearly every Cape Dorset Annual Print Release since 1959. Her images have also been shown throughout Canada, the United States and abroad, and are included in numerous public and private collections."
64.23,-76.54,Shuvinai Ashoona,,Born: 1961,"Shuvinai Ashoona (born 1961, Kinngait, Nunavut) lives and works in Kinngait. Ashoona first came to prominence in the late 1990s, when her work was included in the 1997 Cape Dorset Annual Print Collection. Recent solo presentations of Ashoona’s work include Holding on to Universes at Centre for Contemporary Arts Glasgow (2020), Mapping Worlds, organized by The Power Plant Contemporary Art Gallery in Toronto (2019) and toured to venues across Canada, Nunatta Sunakkutaangit Museum, Iqaluit (2013), MacKenzie Art Gallery, Regina (2012), Carleton University Art Gallery, Ottawa (2009) and Art Gallery of Alberta, Edmonton (2006). She has been included in major group exhibitions including Esker Foundation, Calgary (2017), Art Gallery of Ontario, Toronto (2017), Mercer Union, Toronto (2016), National Gallery of Canada, Ottawa (2014), SITE Santa Fe (2014), 18th Biennale of Sydney (2012) and Massachusetts MoCA, North Adam (2012). Her work resides in a number of public collections including the National Gallery of Canada, Ottawa, the Art Gallery of Ontario, Toronto, Winnipeg Art Gallery, Canadian Museum of History, Ottawa/Gatineau, Montreal Museum of Fine Arts and National Museum of the American Indian, Washington. In 2018, Ashoona was recipient of the prestigious Gershon Iskowitz Prize. From https://www.westbaffin.com/shuvinai-ashoona-cca"
62.2,-75.65,Elisapie Isaac,,,"Elisapie Isaac, known under the artist name Elisapie, was born in Salluit, Nunavik. She is a renowned musician. As a singer and songwriter, her album “The Ballad of the Runaway Girl” (2018) received a 2019 Juno Award nomination for “Indigenous Music Album of the Year” and a 2019 Polaris Music Prize nomination. She also won two Félix Awards in 2019 as well as the 2019 Gamiq Award. Her fourth album, “Inuktitut,” is very successful, with its soundtrack featuring ten popular songs, all in Inuktitut."
70.469,-68.591,Jennifer Jaypoody,,,"Jennifer Jaypoody was Executive Director of Ilisaqsivik and Director of Tukumaaq, both located in Clyde River, starting March 1, 2024. Jennifer was most recently the Vice Principal of Quluaq School and is originally from Clyde River. She brings more than 25 years of experience in increasingly senior roles and is known for successfully facilitating activities that bring Elders and youth together. Jennifer holds a Bachelor of Education degree from the University of Regina. An active community member and volunteer, she has held roles with the Clyde River Co-Op Committee, the District Education Authority Committee, and the Health Committee."
70.4695,-68.5885,Shari Fox ,,,"Originally from Ontario, Shari has spent most of her adult life working and living in Nunavut. Her role at Ittaq is project management, funding, research, and collaborations. A career researcher for over 25 years, Shari is dedicated to supporting Inuit self-determination in research. She was a co-founding member of Ittaq in 2005 and has worked with Inuit on local to international-scale projects across the Arctic. Itttaq Director & Researcher, Clyde River. Shari has a BES and MES from the University of Waterloo, a Ph.D. from the University of Colorado, and a postdoc at Harvard University. She has academic appointments at Carleton University and the University of Colorado. A decade long project she co-led with a team of Inuit, ‘The Meaning of Ice’, won the 2018 inaugral International Mohn Prize for, ‘outstanding research related to the Arctic’. A long-time qimuksiqti (dog teamer), she will ‘talk dogs’ with you all day if you let her. https://ittaq.ca/about/ "
63.7478,-68.5155,Naomi Tatty,,Born: 1979,"Naomi is passionate about Inuit culture and well-being. From Iqaluit, Nunavut, Naomi was named “Inuit Woman of the Year” by Pauktuutit Inuit Women of Canada in 2022. Fluent in Inuktitut and English, Naomi is a healthcare provider who worked with the Government of Nunavut for 18 years. She advocates for ending tuberculosis in Nunavut. Intercultural Health Lead, SeeChange Initiative. "
66.53,-86.25,Dr. Donna May Kimmaliardjuk,,,"Dr. Donna May Kimmaliardjuk is Canada’s first Inuk cardiac surgeon. Her commitment and hard work have not only reduced disparities in terms of access to medical services for the Inuit, but also inspired the next generation of young Inuit to pursue similar careers. She continues to promote health and wellness issues in Indigenous communities, with a particular emphasis on those in Nunavut."
68.15,-52.85,Aaju Peter,,,"Lawyer and activist Aaju Peter was born in Greenland and graduated from Akitsiraq Law School in 2005 and was called to the bar in 2007. She well-known for her protest against the European Union’s sealskin ban. “We have to go through decolonization,” she said, “because our minds are so colonized. The way we think, the way we do things. How we read things, how we understand things. It’s all colonized. It’s not coming from our Inuit world, so we need to find that belief again in our worth.” In 2012 she received the Order of Canada. She has appeared in the documentary films Arctic Defenders (2013) and Angry Inuk (2016). She was also profiled in the 2023 documentary film Twice Colonized."
63.7458,-68.5192,Alethea Arnaquq-Baril,,Born: 1960,"Arnaquq-Baril’s work as a director, producer and screenwriter is built on truths. Her documentaries, such as Angry Inuk and Tunniit: Retracing the Lines of Inuit Tattoos, puts the spotlight on Inuit realities. Her fictional films, like The Grizzlies movie, often do the same. Arnaquq-Baril and Stacey Aglok MacDonald are the creators, executive producers and writers of the APTN, CBC and Netflix series North of North, a sitcom about a young Inuk woman (Siaja, played by Anna Lambe), who’s trying to rebuild her life while everyone in her small Arctic town watches."
61.108,-94.058,Ruth Kaviok,,,"Ruth Kaviok —a Nunavut Sivuniksavut and Students on Ice alumna, the outgoing president of the National Inuit Youth Council and now a fourth-grade teacher—was at the conference to speak about Inuit youth. But she tied her topic to an important lesson: the power of knowing your own past. Kaviok experienced this in her own life. While attending Nunavut Sivuniksavut, she learned about residential schools, and these lessons helped her better understand her father. Kaviok said that they’d had a distant relationship, but when he came to visit, she missed an entire morning of classes as she and her father discussed some difficult topics for the first time. The program, and its focus on history and Inuit knowledge, helped her heal as a person, an Inuk and a daughter, Kaviok said. https://nunatsiaq.com/stories/article/lessons-from-three-powerful-inuit-women/"
43.6532,-79.3832,Miranda de Pencier,,Born: 1968,"Miranda de Pencier is a Canadian film and television director, producer, and actress. She is most noted for her 2011 film Throat Song, which won the Canadian Screen Award for Best Live Action Short Drama at the 1st Canadian Screen Awards. In October 2018, de Pencier won the Directors Guild of Canada award for Best Direction in a Feature Film for The Grizzlies. Based on a true story, the film depicts a youth lacrosse team that was set up to help combat an onslaught of youth suicide in the community of Kugluktuk, Nunavut. Since 2025, Miranda is executive producer of the CBC series North of North."
67.827,-115.096,Stacey Aglok MacDonald,,,"Stacey Aglok is an Inuit Producer/Writer/Director based in Iqaluit, Nunavut. Raised in Kugluktuk, Stacey got her start as a production assistant in documentary. It was her first drama, Throat Song (2013), that launched her career. Since then she has helped produce and direct one of the most well-know Inuit language television shows, Qanurli. She and Alethea Arnaquq-Baril are creators, executive producers and writers of the APTN, CBC and Netflix series North of North, an Inuk mother-daughter comedy set in fictional Ice Cove, Nunavut."
63.7489,-68.5208,Anna Lambe,,Born: 2000,"Anna Lambe (born 25 September 2000) is a Canadian Inuk actress from Iqaluit, Nunavut. She is known for debut role in the 2018 film The Grizzlies, for which she received a Canadian Screen Award nomination for Best Supporting Actress at the 7th Canadian Screen Awards in 2019. Lambe made her film debut as Spring in the 2018 film The Grizzlies, based on a real-life story, as Wynter Kuliktana Blais. She was encouraged to audition for the role by her drama teacher. The film was shot in Iqaluit, Lambe's hometown. The film was met with critical acclaim, and Lambe was nominated for Best Supporting Actress at the 7th Canadian Screen Awards for her performance. In 2020, she had a supporting role as Sarah in the television series Trickster. At the 9th Canadian Screen Awards in 2021, she received a nomination for Best Supporting Actress in a Drama Series. In September 2022, Lambe was cast in the fourth season of True Detective on HBO. In March 2024, Lambe was cast in the lead role of the CBC original comedy series North of North. The series has received 20 nominations for the 2026 Canadian Screen Awards. She actively highlights Inuit representation, reflecting on how her performances and roles, including the 2025 hit North of North, are forms of activism."
63.746,-68.516,Nancy Mike,,,"Nancy Mike is a singer, accordion musician, throat singer, visual artist and a force to be reckoned with. Nancy is the integral part of the Iqaluit based band, 'The Jerry Cans'  ᐸᐃ ᒑᓚᖃᐅᑎᒃᑯᑦ. Nancy's music is a unique mix of Inuktitut alt-country, throat singing, and reggae. She perform many of her songs in Inuktitut and is passionate about preserving the language. Nancy is committed to representing Inuit and to challenging common misperceptions she have encounters about life in the Arctic; her music evokes the contemporary north and the spirited people that reside there. It is not only the political motives, but her rapidly developing reputation for getting elders and young people dancing, that has forced people to start noticing this high-energy group. Her reputation for infectious, high-energy performances has audiences across the globe catching catch a glimpse of life in Arctic. https://www.qaggiavuut.ca/en/inuit-world-artist/nancy-mike"
48.4284,-123.3656,Maeva Gaultier,,,"Co-Investigator, University of Victoria, CINUK. A human geographer Maeve is interested in using arts-based digital tools to engage youth on environmental global changes. For her PhD, she worked with youth in Tuktoyaktuk, NWT, Canada using participatory video to share their perspectives and solutions to climate change. She is also part of the UNESCO Chair in Community-based Research and Social Responsibility in Higher Education working on the themes of open access, decolonization of knowledge, knowledge democracy, and support the next generation of community-based researchers (K4C hubs). https://www.cinuk.org/people/maeva-gauthier/"
65.42,-52.2,Karla Jessen Williamson,,,"Karla Jessen Williamson is an Associate Professor of Educational Foundations at the University of Saskatchewan and the first Inuk to be tenured at Canadian university. She is an Inuk from Greenland. She received her primary education in Greenland and attained her high school education in Denmark. Since moving to Canada, she undertook bachelor’s and master’s degrees in her third language (English) through the University of Saskatchewan. Her master’s thesis dealt with Inuit child-rearing practices as these relate to Inuit relationship to the land in Pangnirtung, Nunavut. Her doctoral studies at the University of Aberdeen in Scotland involved studying gender relations in post-colonial Greenland Inuit communities from an emic point-of-view, offering insight on social construction of gender relations. Dr. Jessen Williamson has published books, articles, and book chapters. She has actively adjudicated for all three national granting councils, applying her extensive knowledge on research and processes as they involve Inuit and other Indigenous peoples in Canada and elsewhere. She was also appointed Executive Director of the Arctic Institute of North America at the University of Calgary, the first female Executive Director since its inception in 1945. Dr. Jessen Williamson’s contribution to discourses on Indigenous epistemology and experiences of the colonial systems is well appreciated locally, nationally, and internationally and include bodies like the United Nations Permanent Forum for Indigenous Peoples. She was appointed to Greenland Commission for Reconciliation that was finalized in 2017. While well versed in the written historical matters of colonialization, Dr. Jessen Williamson has found a niche whereby she analyzed the seemingly of polarized realities of colonizers and the colonized through Inuit lens of oral traditions. She speaks her Indigenous language fluently and uses the Inuit world view to address social and ecological justice. She chairs the University of the Arctic Avatitsinni Committee and is a co-investigator of Inuit youth and climate change. The latter is a collaboration between Canadian researchers, Inuit communities and researchers from the UK universities. https://cca-reports.ca/experts/karla-jessen-williamson/"
58.69,-65.95,Mary Simon,,Born: 1947,"Mary Jeannie May Simon CC CMM COM OQ CD (in Inuktitut syllabics: ᒥᐊᓕ ᓴᐃᒪᓐ; Inuktitut: Ningiukudluk; born August 21, 1947) is a Canadian civil servant, diplomat, and former broadcaster who has served as the 30th governor general of Canada since July 26, 2021- 2006. She is Inuk on her mother's side, making her the first indigenous person to hold the office https://en.wikipedia.org/wiki/Mary_Simon"
,,,,,
69.4454,-133.0374,Carmen Kuptana,,Born: 2002,"Carmen Kuptana, other known as Kaguna, is from way up north and lives in Tuktoyaktuk, NWT, Canada. She is Inuvialuit, very passionate about her culture and loves being out on the land and doing her cultural traditions. Carmen has been involved in the climate change documentary “Happening to us” with CINUK with other young leaders on the youth advisory as a camera operator/ interviewer and editor. In 2024 filmmakers and activists Carmen Kuptana and Eriel Lugt debuted their first independent short film at the Skábmagovat Indigenous Film Festival in Inari, Finland. The festival is the world’s Northernmost Indigenous Peoples’ film festival. Their film, The Children Were Taken from the Land–Now, the Land is Being Taken from the Children, focuses on the impacts of climate change and residential schools within their community of Tukoytaktuk, NWT."
69.4459,-133.0358,Miley Wolki,,Born: 2007 or 2008,"Miley Wolki is an active youth member of the Inuvialuit community in Tuktoyaktuk (Tuktuuyaqtuuq), Northwest Territories, known for her involvement in cultural preservation and media. She has worked with the Inuvialuit Communications Society (ICS), acting as a camera operator and live-streamer for community events like the 2026 Beluga Jamboree Talent Show and jigging contests in Tuktoyaktuk. In early 2025, Miley participated in a Parks Canada oral history project, where she and other students interviewed Tuktuuyaqtuurmiut Elders about their experiences and knowledge of the Pingos. As part of the INSPIRE Program, this collaboration engages with University of Victoria (UVic) Miley and students from the Inuvialuit community to showcase how digital tools can support language revitalization efforts in remote Arctic regions with limited resources (BridgingRoots)."
64.1835,-51.7216,Sara Olsvig ,,Born: 1978,"Sara Olsvig was born in Nuuk, Greenland. She is a Greenlandic politician and former leader (2014–2018) of the Inuit Ataqatigiit political party. She occupied one of Greenland's two seats in the Danish Folketing, 15 September 2011 – 15 September 2014. As of 2022, she is chair of the Inuit Circumpolar Council."
64,32,Anna Varfolomeevan,,,"Anna grew up in Karelia, Northwestern Russia. She is a researcher focusing on the Russian Arctic and Siberia, with a PhD defended in 2019. An Environmental anthropologist, Anna works on human – resource relations and multispecies encounters in the Arctic and Siberia. Her youth in Karelia inspired her passion for Indigenous studies, she studied the rare Veps language at school. Since September 2020, I am a postdoctoral researcher at Helsinki Institute of Sustainability Science (HELSUS), University of Helsinki. My project focuses on indigenous conceptualizations of sustainability in industrialized areas. It analyzes how mining-related narratives become a part of local discourses on sustainability among indigenous communities in Russia."
63.7498,-68.514,Malika Harper,,,"Maika Harper is a Canadian Inuk actress and author from Iqaluit, Nunavut. She is known for her roles in the 2014 drama Mohawk Girls and 2025 comedy series North of North. After attending the University of Windsor, Harper starred in APTN's dramatic comedy, Mohawk Girls. She had guest appearances in the sitcom Kim's Convenience, the legal drama Burden of Truth, and Law and Order Toronto: Criminal Intent. She is author of the book The Walrus and the Caribou, written in both Inuktitut and English. Maika stars as Neevee, the main character Siaja's daughter in North of North (2025)."
34.0522,-118.2437,Mary Lynne Rajskub,,Born: 1971,"Mary Lynn Rajskub was born in Detroit, Michigan. She is an American actress, comedian, and writer known for her roles in 24 and It's Always Sunny in Philadelphia. She stars in the award-winning Arctic-set Netflix/CBC comedy series North of North. Mary Lynn Mary Lynn Rajskub has spoken very highly of her time filming in Iqaluit, Nunavut, calling it a ""magical and meaningful experience"" and sharing stories of her time in Nunavut in various interviews with outlets like Nunatsiaq News and late-night television. She expressed how humbled she felt to learn about Inuit culture, noting how interesting it was to meet local youth who balance modern life with tradition, such as full-time seal hunting."
67.1,-62.3,Tookoolito/Taqulittuq,,Born: 1838,"Taqulittuq (Inuktitut: ᑕᖁᓕᑦᑐᖅ, often transliterated as Tookoolito; c. 1838 – December 31, 1876) was an Inuk interpreter and guide. Tookoolito became known for her talents during the mid-1800s as an Inuk interpreter and advisor to whalers and explorers. Her brother, Eenoolooapik, also gained popularity as an Inuk guide.She and her husband Ipirvik (Ebierbing, also known as Joe) worked alongside Arctic explorer Charles Francis Hall and joined him in his search for Franklin's lost expedition in the 1860s, as well as the Polaris expedition to reach the North Pole. She significantly contributed to non-Inuit’s knowledge of the North. The Government of Canada recognized Tookoolito and Ebierbing as National Historic Persons."
56.8125,-132.9556,Elizabeth Peratrovich ,,Born: 1911,"Elizabeth was (1911-1958) a Tlingit civil rights activist from Petersburg, Alaska, who fought for equality for all Alaska Natives. She was Raven of the Tlingit Lukaax.ádi clan, and a major force behind the passage of Alaska’s Anti-Discrimination Bill in 1945. Elizabeth was Grand President of the Alaska Native Sisterhood. In 2020, the United States Mint released a $1 coin inscribed with Peratrovich's likeness in honor of her historic achievements."
